{
  "source": "strip.png",
  "width": 800,
  "height": 8230,
  "plan_hash": "932164a7a26c8f48b5588f6dd58008f813542ac3a2b2935c9d44bdddd9f11dee",
  "config": {
    "tolerance": 80,
    "max_panel_height": 1600,
    "variance_threshold": 6.0,
    "edge_threshold": 30.0,
    "bubble_pad": 8,
    "use_edge_density": true,
    "min_gutter_run": 4,
    "blur_sigma": 0.5
  },
  "panels": [
    {
      "id": "001aaaaa",
      "panel_index": 1,
      "y_start": 0,
      "y_end": 1593,
      "narration": "",
      "dialogue": "",
      "panel_type": "unknown",
      "confidence": 0.0,
      "image_file": "panel_001aaaaa.png",
      "split_of": "001",
      "merged_with": [
        1,
        2,
        3,
        4
      ],
      "snap_distances": [
        0,
        21
      ]
    },
    {
      "id": "001aaaab",
      "panel_index": 1,
      "y_start": 1593,
      "y_end": 3187,
      "narration": "",
      "dialogue": "",
      "panel_type": "unknown",
      "confidence": 0.0,
      "image_file": "panel_001aaaab.png",
      "split_of": "001",
      "merged_with": [
        1,
        2,
        3,
        4
      ],
      "snap_distances": [
        0,
        21
      ]
    },
    {
      "id": "001aaaba",
      "panel_index": 1,
      "y_start": 3187,
      "y_end": 4780,
      "narration": "",
      "dialogue": "",
      "panel_type": "unknown",
      "confidence": 0.0,
      "image_file": "panel_001aaaba.png",
      "split_of": "001",
      "merged_with": [
        1,
        2,
        3,
        4
      ],
      "snap_distances": [
        0,
        21
      ]
    },
    {
      "id": "001aaabb",
      "panel_index": 1,
      "y_start": 4780,
      "y_end": 6374,
      "narration": "",
      "dialogue": "",
      "panel_type": "unknown",
      "confidence": 0.0,
      "image_file": "panel_001aaabb.png",
      "split_of": "001",
      "merged_with": [
        1,
        2,
        3,
        4
      ],
      "snap_distances": [
        0,
        21
      ]
    },
    {
      "id": "001aab",
      "panel_index": 1,
      "y_start": 6374,
      "y_end": 6377,
      "narration": "",
      "dialogue": "",
      "panel_type": "unknown",
      "confidence": 0.0,
      "image_file": "panel_001aab.png",
      "split_of": "001",
      "merged_with": [
        1,
        2,
        3,
        4
      ],
      "snap_distances": [
        0,
        21
      ]
    },
    {
      "id": "001ab",
      "panel_index": 1,
      "y_start": 6377,
      "y_end": 6383,
      "narration": "",
      "dialogue": "",
      "panel_type": "unknown",
      "confidence": 0.0,
      "image_file": "panel_001ab.png",
      "split_of": "001",
      "merged_with": [
        1,
        2,
        3,
        4
      ],
      "snap_distances": [
        0,
        21
      ]
    },
    {
      "id": "001b",
      "panel_index": 1,
      "y_start": 6383,
      "y_end": 6395,
      "narration": "",
      "dialogue": "",
      "panel_type": "unknown",
      "confidence": 0.0,
      "image_file": "panel_001b.png",
      "split_of": "001",
      "merged_with": [
        1,
        2,
        3,
        4
      ],
      "snap_distances": [
        0,
        21
      ]
    },
    {
      "id": "008",
      "panel_index": 8,
      "y_start": 6395,
      "y_end": 7985,
      "narration": "",
      "dialogue": "",
      "panel_type": "unknown",
      "confidence": 0.0,
      "image_file": "panel_008.png",
      "split_of": null,
      "merged_with": [],
      "snap_distances": [
        0,
        0
      ]
    },
    {
      "id": "009",
      "panel_index": 9,
      "y_start": 7985,
      "y_end": 8230,
      "narration": "",
      "dialogue": "",
      "panel_type": "unknown",
      "confidence": 0.0,
      "image_file": "panel_009.png",
      "split_of": null,
      "merged_with": [],
      "snap_distances": [
        0,
        0
      ]
    }
  ]
}