{
  "source": "strip.webp",
  "width": 800,
  "height": 5645,
  "plan_hash": "60c5c85a97bf321644ca7ac01e5cc26777449dd589b10e73bf5dcb908fa67c58",
  "config": {
    "tolerance": 80,
    "max_panel_height": 1600,
    "variance_threshold": 6.0,
    "edge_threshold": 30.0,
    "bubble_pad": 8,
    "use_edge_density": true,
    "min_gutter_run": 4,
    "blur_sigma": 0.5
  },
  "panels": [
    {
      "id": "001aaaaaa",
      "panel_index": 1,
      "y_start": 0,
      "y_end": 1250,
      "narration": "",
      "dialogue": "",
      "panel_type": "unknown",
      "confidence": 0.0,
      "image_file": "panel_001aaaaaa.png",
      "split_of": "001",
      "merged_with": [
        1,
        2,
        3,
        4
      ],
      "snap_distances": [
        0,
        39
      ]
    },
    {
      "id": "001aaaaab",
      "panel_index": 1,
      "y_start": 1250,
      "y_end": 2501,
      "narration": "",
      "dialogue": "",
      "panel_type": "unknown",
      "confidence": 0.0,
      "image_file": "panel_001aaaaab.png",
      "split_of": "001",
      "merged_with": [
        1,
        2,
        3,
        4
      ],
      "snap_distances": [
        0,
        39
      ]
    },
    {
      "id": "001aaaaba",
      "panel_index": 1,
      "y_start": 2501,
      "y_end": 3751,
      "narration": "",
      "dialogue": "",
      "panel_type": "unknown",
      "confidence": 0.0,
      "image_file": "panel_001aaaaba.png",
      "split_of": "001",
      "merged_with": [
        1,
        2,
        3,
        4
      ],
      "snap_distances": [
        0,
        39
      ]
    },
    {
      "id": "001aaaabb",
      "panel_index": 1,
      "y_start": 3751,
      "y_end": 5002,
      "narration": "",
      "dialogue": "",
      "panel_type": "unknown",
      "confidence": 0.0,
      "image_file": "panel_001aaaabb.png",
      "split_of": "001",
      "merged_with": [
        1,
        2,
        3,
        4
      ],
      "snap_distances": [
        0,
        39
      ]
    },
    {
      "id": "001aaab",
      "panel_index": 1,
      "y_start": 5002,
      "y_end": 5005,
      "narration": "",
      "dialogue": "",
      "panel_type": "unknown",
      "confidence": 0.0,
      "image_file": "panel_001aaab.png",
      "split_of": "001",
      "merged_with": [
        1,
        2,
        3,
        4
      ],
      "snap_distances": [
        0,
        39
      ]
    },
    {
      "id": "001aab",
      "panel_index": 1,
      "y_start": 5005,
      "y_end": 5010,
      "narration": "",
      "dialogue": "",
      "panel_type": "unknown",
      "confidence": 0.0,
      "image_file": "panel_001aab.png",
      "split_of": "001",
      "merged_with": [
        1,
        2,
        3,
        4
      ],
      "snap_distances": [
        0,
        39
      ]
    },
    {
      "id": "001ab",
      "panel_index": 1,
      "y_start": 5010,
      "y_end": 5020,
      "narration": "",
      "dialogue": "",
      "panel_type": "unknown",
      "confidence": 0.0,
      "image_file": "panel_001ab.png",
      "split_of": "001",
      "merged_with": [
        1,
        2,
        3,
        4
      ],
      "snap_distances": [
        0,
        39
      ]
    },
    {
      "id": "001b",
      "panel_index": 1,
      "y_start": 5020,
      "y_end": 5041,
      "narration": "",
      "dialogue": "",
      "panel_type": "unknown",
      "confidence": 0.0,
      "image_file": "panel_001b.png",
      "split_of": "001",
      "merged_with": [
        1,
        2,
        3,
        4
      ],
      "snap_distances": [
        0,
        39
      ]
    },
    {
      "id": "005",
      "panel_index": 5,
      "y_start": 5041,
      "y_end": 5042,
      "narration": "",
      "dialogue": "",
      "panel_type": "unknown",
      "confidence": 0.0,
      "image_file": "panel_005.png",
      "split_of": null,
      "merged_with": [],
      "snap_distances": [
        39,
        38
      ]
    },
    {
      "id": "006",
      "panel_index": 6,
      "y_start": 5042,
      "y_end": 5045,
      "narration": "",
      "dialogue": "",
      "panel_type": "unknown",
      "confidence": 0.0,
      "image_file": "panel_006.png",
      "split_of": null,
      "merged_with": [],
      "snap_distances": [
        38,
        36
      ]
    },
    {
      "id": "007",
      "panel_index": 7,
      "y_start": 5045,
      "y_end": 5049,
      "narration": "",
      "dialogue": "",
      "panel_type": "unknown",
      "confidence": 0.0,
      "image_file": "panel_007.png",
      "split_of": null,
      "merged_with": [],
      "snap_distances": [
        36,
        31
      ]
    },
    {
      "id": "008",
      "panel_index": 8,
      "y_start": 5049,
      "y_end": 5058,
      "narration": "",
      "dialogue": "",
      "panel_type": "unknown",
      "confidence": 0.0,
      "image_file": "panel_008.png",
      "split_of": null,
      "merged_with": [],
      "snap_distances": [
        31,
        22
      ]
    },
    {
      "id": "009",
      "panel_index": 9,
      "y_start": 5058,
      "y_end": 5076,
      "narration": "",
      "dialogue": "",
      "panel_type": "unknown",
      "confidence": 0.0,
      "image_file": "panel_009.png",
      "split_of": null,
      "merged_with": [],
      "snap_distances": [
        22,
        4
      ]
    },
    {
      "id": "010",
      "panel_index": 10,
      "y_start": 5076,
      "y_end": 5144,
      "narration": "",
      "dialogue": "",
      "panel_type": "unknown",
      "confidence": 0.0,
      "image_file": "panel_010.png",
      "split_of": null,
      "merged_with": [],
      "snap_distances": [
        4,
        0
      ]
    },
    {
      "id": "011",
      "panel_index": 11,
      "y_start": 5144,
      "y_end": 5289,
      "narration": "",
      "dialogue": "",
      "panel_type": "unknown",
      "confidence": 0.0,
      "image_file": "panel_011.png",
      "split_of": null,
      "merged_with": [],
      "snap_distances": [
        0,
        0
      ]
    },
    {
      "id": "012",
      "panel_index": 12,
      "y_start": 5289,
      "y_end": 5645,
      "narration": "",
      "dialogue": "",
      "panel_type": "unknown",
      "confidence": 0.0,
      "image_file": "panel_012.png",
      "split_of": null,
      "merged_with": [],
      "snap_distances": [
        0,
        0
      ]
    }
  ]
}