{
  "source": "006.webp",
  "width": 800,
  "height": 10000,
  "plan_hash": "5f6e43727f9257b813a242f246d91e9cf814d5a8f24b6e09192c1dc331b52a15",
  "config": {
    "tolerance": 80,
    "max_panel_height": 1600,
    "variance_threshold": 6.0,
    "edge_threshold": 30.0,
    "bubble_pad": 8,
    "use_edge_density": true,
    "min_gutter_run": 4,
    "blur_sigma": 0.5,
    "min_panel_height": 150,
    "output_width": 390,
    "min_output_height": 760,
    "max_output_height": 800,
    "normalize_output": true,
    "preserve_boundaries": false,
    "blank_detection": true,
    "blank_preset": "conservative"
  },
  "panels": [
    {
      "id": "001a",
      "panel_index": 1,
      "y_start": 0,
      "y_end": 555,
      "narration": "Two men shake hands in the snow while others watch from behind them.",
      "dialogue": "Top bubble: \"Sorry for the hold-up.\" Bottom bubble: \"Hold-up? You're literally the first ones here.\"",
      "panel_type": "single",
      "confidence": 0.95,
      "image_file": "panel_001a.png",
      "output_width": 390,
      "output_height": 760,
      "strip_width": null,
      "split_of": "001",
      "merged_with": [],
      "snap_distances": [
        0,
        154
      ],
      "snap_measured": [
        false,
        true
      ],
      "blank_score": 0.221,
      "blank_flag": "normal",
      "blank_reasons": [
        "variance=1611.27",
        "edge_density=26.91",
        "entropy=1.09",
        "color_spread=73.72",
        "fg_ratio=0.041"
      ],
      "context_only": false
    },
    {
      "id": "001b",
      "panel_index": 1,
      "y_start": 555,
      "y_end": 2054,
      "narration": "Two men shake hands in the snow while others watch from behind them.",
      "dialogue": "Top bubble: \"Sorry for the hold-up.\" Bottom bubble: \"Hold-up? You're literally the first ones here.\"",
      "panel_type": "single",
      "confidence": 0.95,
      "image_file": "panel_001b.png",
      "output_width": 390,
      "output_height": 760,
      "strip_width": null,
      "split_of": "001",
      "merged_with": [],
      "snap_distances": [
        0,
        154
      ],
      "snap_measured": [
        false,
        true
      ],
      "blank_score": 0.0,
      "blank_flag": "normal",
      "blank_reasons": [
        "variance=10086.41",
        "edge_density=47.81",
        "entropy=3.96",
        "color_spread=81.24",
        "fg_ratio=0.3704"
      ],
      "context_only": false
    },
    {
      "id": "003a",
      "panel_index": 3,
      "y_start": 2250,
      "y_end": 4556,
      "narration": "Someone mentions that the martial clans are joining in today. A group of armed individuals gather in a snowy landscape preparing for battle. Soldiers in heavy winter gear are shown in a battle scene. A lone speech bubble floats in empty white space. An icy, cold environment with glowing structures is shown. A person in dark clothing and gloves holds a knife in a snowy environment.",
      "dialogue": "I HEARD EVEN THE MARTIAL CLANS ARE JOINING IN TODAY. THE NARUKAMI SUBARU IS LEADING THE NARUKAMI SUBARU IS LEADING THE CHARGE, AFTER ALL. THEY PROBABLY JUST WANNA GRAB WHATEVER SCRAPS YOU LEAVE BEHIND. IF THEY'RE AFTER SCRAPS... 푸윽",
      "panel_type": "transition_gutter",
      "confidence": 0.88,
      "image_file": "panel_003a.png",
      "output_width": 800,
      "output_height": 2306,
      "strip_width": null,
      "split_of": "003",
      "merged_with": [
        3,
        4,
        5,
        6,
        7,
        8
      ],
      "snap_distances": [
        150,
        0
      ],
      "snap_measured": [
        true,
        true
      ],
      "blank_score": 0.0,
      "blank_flag": "normal",
      "blank_reasons": [
        "variance=8571.33",
        "edge_density=62.62",
        "entropy=4.5",
        "color_spread=97.02",
        "fg_ratio=0.4905"
      ],
      "context_only": false
    },
    {
      "id": "003b",
      "panel_index": 3,
      "y_start": 4556,
      "y_end": 6760,
      "narration": "Someone mentions that the martial clans are joining in today. A group of armed individuals gather in a snowy landscape preparing for battle. Soldiers in heavy winter gear are shown in a battle scene. A lone speech bubble floats in empty white space. An icy, cold environment with glowing structures is shown. A person in dark clothing and gloves holds a knife in a snowy environment.",
      "dialogue": "I HEARD EVEN THE MARTIAL CLANS ARE JOINING IN TODAY. THE NARUKAMI SUBARU IS LEADING THE NARUKAMI SUBARU IS LEADING THE CHARGE, AFTER ALL. THEY PROBABLY JUST WANNA GRAB WHATEVER SCRAPS YOU LEAVE BEHIND. IF THEY'RE AFTER SCRAPS... 푸윽",
      "panel_type": "transition_gutter",
      "confidence": 0.88,
      "image_file": "panel_003b.png",
      "output_width": 800,
      "output_height": 2204,
      "strip_width": null,
      "split_of": "003",
      "merged_with": [
        3,
        4,
        5,
        6,
        7,
        8
      ],
      "snap_distances": [
        150,
        0
      ],
      "snap_measured": [
        true,
        true
      ],
      "blank_score": 0.0,
      "blank_flag": "normal",
      "blank_reasons": [
        "variance=9605.69",
        "edge_density=29.57",
        "entropy=3.2",
        "color_spread=153.61",
        "fg_ratio=0.3207"
      ],
      "context_only": false
    },
    {
      "id": "009",
      "panel_index": 9,
      "y_start": 6760,
      "y_end": 10000,
      "narration": "A speech bubble appears with text. Two men in dark winter coats shake hands in a snowy landscape under glowing structures. A gloved hand holds out a glowing ring on white cloth while another gloved hand reaches toward it against a pink sparkling background.",
      "dialogue": "I'VE GOT ONE RIGHT HERE. ONE RIGHT HERE. ...?",
      "panel_type": "single",
      "confidence": 0.85,
      "image_file": "panel_009.png",
      "output_width": 800,
      "output_height": 3240,
      "strip_width": null,
      "split_of": null,
      "merged_with": [
        9,
        10,
        11
      ],
      "snap_distances": [
        0,
        0
      ],
      "snap_measured": [
        true,
        false
      ],
      "blank_score": 0.0,
      "blank_flag": "normal",
      "blank_reasons": [
        "variance=8322.25",
        "edge_density=28.93",
        "entropy=4.46",
        "color_spread=74.64",
        "fg_ratio=0.3547"
      ],
      "context_only": false
    }
  ],
  "blank_detection_skipped": false
}