{
  "source": "008.webp",
  "width": 800,
  "height": 9390,
  "plan_hash": "2e8b7d5bf3f0395b11bd7e9c481d75bb3548ee0766847bf569bbd20ad640c6ad",
  "config": {
    "tolerance": 80,
    "max_panel_height": 1600,
    "variance_threshold": 6.0,
    "edge_threshold": 30.0,
    "bubble_pad": 8,
    "use_edge_density": true,
    "min_gutter_run": 4,
    "blur_sigma": 0.5,
    "min_panel_height": 150,
    "output_width": 390,
    "min_output_height": 760,
    "max_output_height": 800,
    "normalize_output": true,
    "preserve_boundaries": false,
    "blank_detection": true,
    "blank_preset": "conservative"
  },
  "panels": [
    {
      "id": "001",
      "panel_index": 1,
      "y_start": 0,
      "y_end": 1480,
      "narration": "A gloved hand holds out a glowing red ring.",
      "dialogue": "YOU CAN GIVE IT BACK TO ME THEN.",
      "panel_type": "single",
      "confidence": 0.95,
      "image_file": "panel_001.png",
      "output_width": 390,
      "output_height": 760,
      "strip_width": null,
      "split_of": null,
      "merged_with": [],
      "snap_distances": [
        0,
        0
      ],
      "snap_measured": [
        false,
        true
      ],
      "blank_score": 0.0,
      "blank_flag": "normal",
      "blank_reasons": [
        "variance=9042.38",
        "edge_density=35.85",
        "entropy=3.64",
        "color_spread=57.49",
        "fg_ratio=0.3493"
      ],
      "context_only": false
    },
    {
      "id": "002",
      "panel_index": 2,
      "y_start": 1480,
      "y_end": 3700,
      "narration": "Two characters face each other in cold weather, with one showing a faint smile.",
      "dialogue": "......",
      "panel_type": "single",
      "confidence": 0.92,
      "image_file": "panel_002.png",
      "output_width": 800,
      "output_height": 2220,
      "strip_width": null,
      "split_of": null,
      "merged_with": [],
      "snap_distances": [
        0,
        0
      ],
      "snap_measured": [
        true,
        true
      ],
      "blank_score": 0.0,
      "blank_flag": "normal",
      "blank_reasons": [
        "variance=9429.96",
        "edge_density=23.1",
        "entropy=3.52",
        "color_spread=87.29",
        "fg_ratio=0.251"
      ],
      "context_only": false
    },
    {
      "id": "003",
      "panel_index": 3,
      "y_start": 3700,
      "y_end": 5940,
      "narration": "A masked figure in dark clothing stands in a snowy environment, speaking to a light-haired person. A person grabs another's arm in the cold.",
      "dialogue": "WELL, IF YOU'D RATHER NOT RETURN, YOU CAN ALSO JUST HANG ONTO IT FOREVER. Tick",
      "panel_type": "single",
      "confidence": 0.9,
      "image_file": "panel_003.png",
      "output_width": 800,
      "output_height": 2240,
      "strip_width": null,
      "split_of": null,
      "merged_with": [
        3,
        4
      ],
      "snap_distances": [
        0,
        120
      ],
      "snap_measured": [
        true,
        true
      ],
      "blank_score": 0.0,
      "blank_flag": "normal",
      "blank_reasons": [
        "variance=8699.09",
        "edge_density=35.73",
        "entropy=3.63",
        "color_spread=60.1",
        "fg_ratio=0.2451"
      ],
      "context_only": false
    },
    {
      "id": "005",
      "panel_index": 5,
      "y_start": 5940,
      "y_end": 9390,
      "narration": "Snow falls heavily across a vast, icy landscape. A masked figure in dark clothing confronts a shocked light-haired man in the rain",
      "dialogue": "Hooong !!",
      "panel_type": "single",
      "confidence": 0.95,
      "image_file": "panel_005.png",
      "output_width": 800,
      "output_height": 3450,
      "strip_width": null,
      "split_of": null,
      "merged_with": [
        5,
        6
      ],
      "snap_distances": [
        120,
        0
      ],
      "snap_measured": [
        true,
        false
      ],
      "blank_score": 0.0,
      "blank_flag": "normal",
      "blank_reasons": [
        "variance=6364.35",
        "edge_density=36.23",
        "entropy=4.44",
        "color_spread=92.86",
        "fg_ratio=0.2521"
      ],
      "context_only": false
    }
  ],
  "blank_detection_skipped": false
}