{
  "source": "007.webp",
  "width": 800,
  "height": 9590,
  "plan_hash": "d5787074a5432725d3834327cc6cee254d22e39ff76943987beb02fbf08207ba",
  "config": {
    "tolerance": 80,
    "max_panel_height": 1600,
    "variance_threshold": 6.0,
    "edge_threshold": 30.0,
    "bubble_pad": 8,
    "use_edge_density": true,
    "min_gutter_run": 4,
    "blur_sigma": 0.5,
    "min_panel_height": 150,
    "output_width": 390,
    "min_output_height": 760,
    "max_output_height": 800,
    "normalize_output": true,
    "preserve_boundaries": false,
    "blank_detection": true,
    "blank_preset": "conservative"
  },
  "panels": [
    {
      "id": "001",
      "panel_index": 1,
      "y_start": 0,
      "y_end": 3500,
      "narration": "A large purple holographic status window hovers above a young man's face while snow falls around him. A character in dark clothing holds a glowing red gem in their gloved hand as snow falls around them.",
      "dialogue": "[BLESSING OF THE ARCHANGEL] #RANK: LEGENDARY #EQUIP LV: 50+ WHEN FATIGUE HITS 100, HALF OF IT IS INSTANTLY RESTORED. #USE(S) LEFT: 1 THIS IS...!",
      "panel_type": "single",
      "confidence": 0.95,
      "image_file": "panel_001.png",
      "output_width": 800,
      "output_height": 3500,
      "strip_width": null,
      "split_of": null,
      "merged_with": [
        1,
        2
      ],
      "snap_distances": [
        0,
        0
      ],
      "snap_measured": [
        false,
        true
      ],
      "blank_score": 0.0,
      "blank_flag": "normal",
      "blank_reasons": [
        "variance=7363.38",
        "edge_density=33.11",
        "entropy=4.12",
        "color_spread=59.39",
        "fg_ratio=0.2756"
      ],
      "context_only": false
    },
    {
      "id": "003",
      "panel_index": 3,
      "y_start": 3500,
      "y_end": 6339,
      "narration": "Two characters talk in snowy weather while one speaks about clearing a raid perfectly. A character in a dark winter coat with fur collar speaks, their gloved fist clenched.",
      "dialogue": "I INTEND TO CLEAR THIS RAID PERFECTLY, BUT... JUST IN CASE, KEEP THAT ON YOU. BUT YOU NEED THIS WAY MORE THAN I DO...",
      "panel_type": "single",
      "confidence": 0.92,
      "image_file": "panel_003.png",
      "output_width": 800,
      "output_height": 2839,
      "strip_width": null,
      "split_of": null,
      "merged_with": [
        3,
        4
      ],
      "snap_distances": [
        0,
        39
      ],
      "snap_measured": [
        true,
        true
      ],
      "blank_score": 0.0,
      "blank_flag": "normal",
      "blank_reasons": [
        "variance=8985.4",
        "edge_density=36.25",
        "entropy=3.45",
        "color_spread=66.24",
        "fg_ratio=0.35"
      ],
      "context_only": false
    },
    {
      "id": "005",
      "panel_index": 5,
      "y_start": 6339,
      "y_end": 9101,
      "narration": "Two speech bubbles float on white background as the dialogue continues. A masked man speaks to someone in the snow.",
      "dialogue": "ALSO, AFTER THIS FIGHT, HOW ABOUT COMING BACK TO BLUE HOW ABOUT COMING BACK TO BLUE EYES?",
      "panel_type": "single",
      "confidence": 0.92,
      "image_file": "panel_005.png",
      "output_width": 800,
      "output_height": 2762,
      "strip_width": null,
      "split_of": null,
      "merged_with": [
        5,
        6
      ],
      "snap_distances": [
        39,
        1
      ],
      "snap_measured": [
        true,
        true
      ],
      "blank_score": 0.0,
      "blank_flag": "normal",
      "blank_reasons": [
        "variance=8810.95",
        "edge_density=29.36",
        "entropy=3.27",
        "color_spread=76.92",
        "fg_ratio=0.2678"
      ],
      "context_only": false
    }
  ],
  "blank_detection_skipped": false
}