{
  "source": "strippng",
  "width": 800,
  "height": 4400,
  "plan_hash": "3238a2c3bf8af39e5cf152c691173cb640d675379c51dd31a8316e3cfd754459",
  "config": {
    "tolerance": 80,
    "max_panel_height": 1600,
    "variance_threshold": 6.0,
    "edge_threshold": 30.0,
    "bubble_pad": 8,
    "use_edge_density": true,
    "min_gutter_run": 4,
    "blur_sigma": 0.5
  },
  "panels": [
    {
      "id": "001aaa",
      "panel_index": 1,
      "y_start": 240,
      "y_end": 1071,
      "narration": "A character is standing in a room with a desk and a chair. John is standing in front of a desk with a chair behind him. John is standing in front of a desk with a chair behind him.",
      "dialogue": "What's going on?",
      "panel_type": "single",
      "confidence": 0.95,
      "image_file": "panel_001aaa.png",
      "split_of": "001",
      "merged_with": [
        1,
        2,
        3
      ],
      "snap_distances": [
        0,
        0
      ]
    },
    {
      "id": "001aab",
      "panel_index": 1,
      "y_start": 1071,
      "y_end": 1903,
      "narration": "A character is standing in a room with a desk and a chair. John is standing in front of a desk with a chair behind him. John is standing in front of a desk with a chair behind him.",
      "dialogue": "What's going on?",
      "panel_type": "single",
      "confidence": 0.95,
      "image_file": "panel_001aab.png",
      "split_of": "001",
      "merged_with": [
        1,
        2,
        3
      ],
      "snap_distances": [
        0,
        0
      ]
    },
    {
      "id": "001ab",
      "panel_index": 1,
      "y_start": 1903,
      "y_end": 1907,
      "narration": "A character is standing in a room with a desk and a chair. John is standing in front of a desk with a chair behind him. John is standing in front of a desk with a chair behind him.",
      "dialogue": "What's going on?",
      "panel_type": "single",
      "confidence": 0.95,
      "image_file": "panel_001ab.png",
      "split_of": "001",
      "merged_with": [
        1,
        2,
        3
      ],
      "snap_distances": [
        0,
        0
      ]
    },
    {
      "id": "001ba",
      "panel_index": 1,
      "y_start": 1907,
      "y_end": 2807,
      "narration": "A character is standing in a room with a desk and a chair. John is standing in front of a desk with a chair behind him. John is standing in front of a desk with a chair behind him.",
      "dialogue": "What's going on?",
      "panel_type": "single",
      "confidence": 0.95,
      "image_file": "panel_001ba.png",
      "split_of": "001",
      "merged_with": [
        1,
        2,
        3
      ],
      "snap_distances": [
        0,
        0
      ]
    },
    {
      "id": "001bb",
      "panel_index": 1,
      "y_start": 2807,
      "y_end": 4016,
      "narration": "A character is standing in a room with a desk and a chair. John is standing in front of a desk with a chair behind him. John is standing in front of a desk with a chair behind him.",
      "dialogue": "What's going on?",
      "panel_type": "single",
      "confidence": 0.95,
      "image_file": "panel_001bb.png",
      "split_of": "001",
      "merged_with": [
        1,
        2,
        3
      ],
      "snap_distances": [
        0,
        0
      ]
    }
  ]
}