{
  "source": "strippng",
  "width": 800,
  "height": 4400,
  "plan_hash": "44d4b0435a839e4f9d1518d880e8defbf38da57d81adef4c8fa6edcfe1c11c07",
  "config": {
    "tolerance": 80,
    "max_panel_height": 1600,
    "variance_threshold": 6.0,
    "edge_threshold": 30.0,
    "bubble_pad": 8,
    "use_edge_density": true,
    "min_gutter_run": 4,
    "blur_sigma": 0.5
  },
  "panels": [
    {
      "id": "001",
      "panel_index": 1,
      "y_start": 0,
      "y_end": 1107,
      "narration": "",
      "dialogue": "",
      "panel_type": "unknown",
      "confidence": 0.0,
      "image_file": "panel_001.png",
      "split_of": null,
      "merged_with": [],
      "snap_distances": [
        0,
        0
      ]
    },
    {
      "id": "002",
      "panel_index": 2,
      "y_start": 1107,
      "y_end": 1907,
      "narration": "",
      "dialogue": "",
      "panel_type": "unknown",
      "confidence": 0.0,
      "image_file": "panel_002.png",
      "split_of": null,
      "merged_with": [],
      "snap_distances": [
        0,
        0
      ]
    },
    {
      "id": "003",
      "panel_index": 3,
      "y_start": 1907,
      "y_end": 2807,
      "narration": "",
      "dialogue": "",
      "panel_type": "unknown",
      "confidence": 0.0,
      "image_file": "panel_003.png",
      "split_of": null,
      "merged_with": [],
      "snap_distances": [
        0,
        0
      ]
    },
    {
      "id": "004",
      "panel_index": 4,
      "y_start": 2807,
      "y_end": 3707,
      "narration": "",
      "dialogue": "",
      "panel_type": "unknown",
      "confidence": 0.0,
      "image_file": "panel_004.png",
      "split_of": null,
      "merged_with": [],
      "snap_distances": [
        0,
        0
      ]
    },
    {
      "id": "005",
      "panel_index": 5,
      "y_start": 3707,
      "y_end": 4400,
      "narration": "",
      "dialogue": "",
      "panel_type": "unknown",
      "confidence": 0.0,
      "image_file": "panel_005.png",
      "split_of": null,
      "merged_with": [],
      "snap_distances": [
        0,
        0
      ]
    }
  ]
}